<?xml version="1.0" encoding="UTF-8"?>

<xsd:schema xmlns:xsd="http://www.w3.org/2001/XMLSchema"
    targetNamespace="http://xml.netbeans.org/schema/ZonalesSolrQueryRequerimiento"
    xmlns:tns="http://xml.netbeans.org/schema/ZonalesSolrQueryRequerimiento"
    elementFormDefault="qualified">
    <xsd:complexType name="parametroType">
        <xsd:all>
            <xsd:element name="clave" type="xsd:string"></xsd:element>
            <xsd:element name="valor" type="xsd:string"></xsd:element>
        </xsd:all>
    </xsd:complexType>
    <xsd:complexType name="parametrosType">
        <xsd:sequence>
            <xsd:element name="parametro" type="tns:parametroType" maxOccurs="unbounded" minOccurs="0"></xsd:element>
        </xsd:sequence>
    </xsd:complexType>
    <xsd:complexType name="contenidoType">
        <xsd:sequence>
            <xsd:element name="query" type="xsd:string"></xsd:element>
            <xsd:element name="sortFields" type="tns:sortFieldsType"></xsd:element>
            <xsd:element name="parametros" type="tns:parametrosType" minOccurs="0"></xsd:element>
        </xsd:sequence>
    </xsd:complexType>
    <xsd:element name="requerimiento">
        <xsd:complexType>
            <xsd:all>
                <xsd:element name="contenido" type="tns:contenidoType"></xsd:element>
            </xsd:all>
        </xsd:complexType>
    </xsd:element>
    <xsd:complexType name="sortType">
        <xsd:attribute name="field" type="xsd:string"/>
        <xsd:attribute name="order" type="xsd:string"/>
    </xsd:complexType>
    <xsd:complexType name="sortFieldsType">
        <xsd:sequence>
            <xsd:element name="sort" type="tns:sortType" minOccurs="0" maxOccurs="unbounded"></xsd:element>
        </xsd:sequence>
    </xsd:complexType>
</xsd:schema>




